{
  "schema_version": "0.1",
  "corpus": {
    "name": "tts-text-en-us",
    "version": "1"
  },
  "language": "en-US",
  "voice": "af_heart",
  "tokenizer": {
    "rule": "kokoro-kpipeline-g2p-length-v1",
    "lock": "packaging/speech-runtime/lock/kokoro.txt",
    "g2p_pins_sha256": "71cbbe1e7af243621020312f566700e6826fadd73da89d750d06fb4eaaccba96",
    "kokoro": "0.9.4",
    "misaki": "0.9.4",
    "spacy": "3.8.16",
    "en_core_web_sm": "3.8.0",
    "espeak_ng": "1.51+dfsg-12build1"
  },
  "sources": [
    {
      "id": "cmu-arctic",
      "title": "CMU ARCTIC prompt list (cmuarctic.data)",
      "license": "CMU-ARCTIC",
      "attribution": "CMU ARCTIC databases, Carnegie Mellon University, Copyright (c) 2003. Permission to use, copy, modify and license for any purpose is granted without fee, provided the copyright notice, conditions and disclaimer are retained, modifications are marked and the authors' names are not deleted; the prompts are used unmodified. See http://www.festvox.org/cmu_arctic/ The notice, conditions and disclaimer are kept verbatim in tools/validation/corpus/cmu-arctic-COPYING.txt.",
      "url": "http://festvox.org/cmu_arctic/cmuarctic.data",
      "sha256": "60e3d9a4dc33732c9100baadd747312bdc1a200fc891766507397289753a25c7"
    },
    {
      "id": "libritts-r",
      "title": "LibriTTS-R test-clean (openslr 141)",
      "license": "CC-BY-4.0",
      "attribution": "LibriTTS-R: A Restored Multi-Speaker Text-to-Speech Corpus, Y. Koizumi, H. Zen, S. Karita, Y. Ding, K. Yatabe, N. Morioka, M. Bacchiani, Y. Zhang, W. Han and A. Bapna, 2023; CC BY 4.0. Text used unmodified. License: https://creativecommons.org/licenses/by/4.0/",
      "url": "https://www.openslr.org/resources/141/test_clean.tar.gz",
      "sha256": "d4a2a7cdeeb68a6cfd628559739879bcb29556364cc13f38413930d59369a7f1",
      "md5": "4d373d453eb96c0691e598061bbafab7",
      "text_form": "original"
    },
    {
      "id": "authored",
      "title": "Sentences written for this corpus",
      "license": "CC0-1.0",
      "attribution": "The TensorPlate authors, dedicated to the public domain under CC0 1.0.",
      "url": null,
      "sha256": null
    }
  ],
  "sentences": [
    {
      "id": "arctic-a0030",
      "text": "I had faith in them.",
      "source": "cmu-arctic",
      "source_id": "arctic_a0030",
      "phoneme_tokens": 20,
      "stratum": "t1to20",
      "critical": []
    },
    {
      "id": "arctic-a0098",
      "text": "Shall I carry you.",
      "source": "cmu-arctic",
      "source_id": "arctic_a0098",
      "phoneme_tokens": 17,
      "stratum": "t1to20",
      "critical": []
    },
    {
      "id": "arctic-a0158",
      "text": "Does that look good.",
      "source": "cmu-arctic",
      "source_id": "arctic_a0158",
      "phoneme_tokens": 20,
      "stratum": "t1to20",
      "critical": []
    },
    {
      "id": "arctic-a0207",
      "text": "How much was it.",
      "source": "cmu-arctic",
      "source_id": "arctic_a0207",
      "phoneme_tokens": 16,
      "stratum": "t1to20",
      "critical": []
    },
    {
      "id": "arctic-a0287",
      "text": "Keep an eye on him.",
      "source": "cmu-arctic",
      "source_id": "arctic_a0287",
      "phoneme_tokens": 20,
      "stratum": "t1to20",
      "critical": []
    },
    {
      "id": "arctic-a0329",
      "text": "Ah, indeed.",
      "source": "cmu-arctic",
      "source_id": "arctic_a0329",
      "phoneme_tokens": 11,
      "stratum": "t1to20",
      "critical": []
    },
    {
      "id": "arctic-a0381",
      "text": "My name's Ferguson.",
      "source": "cmu-arctic",
      "source_id": "arctic_a0381",
      "phoneme_tokens": 20,
      "stratum": "t1to20",
      "critical": []
    },
    {
      "id": "arctic-a0389",
      "text": "Mab, she said.",
      "source": "cmu-arctic",
      "source_id": "arctic_a0389",
      "phoneme_tokens": 14,
      "stratum": "t1to20",
      "critical": []
    },
    {
      "id": "arctic-a0484",
      "text": "No-sir-ee.",
      "source": "cmu-arctic",
      "source_id": "arctic_a0484",
      "phoneme_tokens": 10,
      "stratum": "t1to20",
      "critical": [
        "negation"
      ]
    },
    {
      "id": "arctic-a0562",
      "text": "What the flaming.",
      "source": "cmu-arctic",
      "source_id": "arctic_a0562",
      "phoneme_tokens": 16,
      "stratum": "t1to20",
      "critical": []
    },
    {
      "id": "arctic-b0166",
      "text": "Fast, but endure.",
      "source": "cmu-arctic",
      "source_id": "arctic_b0166",
      "phoneme_tokens": 19,
      "stratum": "t1to20",
      "critical": []
    },
    {
      "id": "arctic-b0211",
      "text": "This is eighteen eighty.",
      "source": "cmu-arctic",
      "source_id": "arctic_b0211",
      "phoneme_tokens": 20,
      "stratum": "t1to20",
      "critical": []
    },
    {
      "id": "arctic-b0228",
      "text": "You were engaged.",
      "source": "cmu-arctic",
      "source_id": "arctic_b0228",
      "phoneme_tokens": 16,
      "stratum": "t1to20",
      "critical": []
    },
    {
      "id": "arctic-b0435",
      "text": "Well, did they eat.",
      "source": "cmu-arctic",
      "source_id": "arctic_b0435",
      "phoneme_tokens": 18,
      "stratum": "t1to20",
      "critical": []
    },
    {
      "id": "arctic-b0454",
      "text": "Eighteen, he added.",
      "source": "cmu-arctic",
      "source_id": "arctic_b0454",
      "phoneme_tokens": 17,
      "stratum": "t1to20",
      "critical": []
    },
    {
      "id": "authored-001",
      "text": "Yes.",
      "source": "authored",
      "source_id": null,
      "phoneme_tokens": 5,
      "stratum": "t1to20",
      "critical": []
    },
    {
      "id": "authored-002",
      "text": "No.",
      "source": "authored",
      "source_id": null,
      "phoneme_tokens": 4,
      "stratum": "t1to20",
      "critical": [
        "negation"
      ]
    },
    {
      "id": "authored-003",
      "text": "Okay, thanks.",
      "source": "authored",
      "source_id": null,
      "phoneme_tokens": 14,
      "stratum": "t1to20",
      "critical": []
    },
    {
      "id": "authored-004",
      "text": "Sure.",
      "source": "authored",
      "source_id": null,
      "phoneme_tokens": 5,
      "stratum": "t1to20",
      "critical": []
    },
    {
      "id": "authored-005",
      "text": "Got it.",
      "source": "authored",
      "source_id": null,
      "phoneme_tokens": 8,
      "stratum": "t1to20",
      "critical": []
    },
    {
      "id": "authored-006",
      "text": "One moment, please.",
      "source": "authored",
      "source_id": null,
      "phoneme_tokens": 20,
      "stratum": "t1to20",
      "critical": []
    },
    {
      "id": "authored-007",
      "text": "Thank you!",
      "source": "authored",
      "source_id": null,
      "phoneme_tokens": 9,
      "stratum": "t1to20",
      "critical": []
    },
    {
      "id": "authored-008",
      "text": "Hello there.",
      "source": "authored",
      "source_id": null,
      "phoneme_tokens": 11,
      "stratum": "t1to20",
      "critical": []
    },
    {
      "id": "authored-009",
      "text": "Goodbye.",
      "source": "authored",
      "source_id": null,
      "phoneme_tokens": 8,
      "stratum": "t1to20",
      "critical": []
    },
    {
      "id": "authored-010",
      "text": "Sounds good.",
      "source": "authored",
      "source_id": null,
      "phoneme_tokens": 12,
      "stratum": "t1to20",
      "critical": []
    },
    {
      "id": "authored-011",
      "text": "I'm sorry?",
      "source": "authored",
      "source_id": null,
      "phoneme_tokens": 10,
      "stratum": "t1to20",
      "critical": []
    },
    {
      "id": "authored-012",
      "text": "Not right now.",
      "source": "authored",
      "source_id": null,
      "phoneme_tokens": 14,
      "stratum": "t1to20",
      "critical": [
        "negation"
      ]
    },
    {
      "id": "authored-013",
      "text": "Never mind.",
      "source": "authored",
      "source_id": null,
      "phoneme_tokens": 13,
      "stratum": "t1to20",
      "critical": [
        "negation"
      ]
    },
    {
      "id": "authored-014",
      "text": "Don't worry.",
      "source": "authored",
      "source_id": null,
      "phoneme_tokens": 12,
      "stratum": "t1to20",
      "critical": [
        "negation"
      ]
    },
    {
      "id": "authored-015",
      "text": "I can't hear you.",
      "source": "authored",
      "source_id": null,
      "phoneme_tokens": 17,
      "stratum": "t1to20",
      "critical": [
        "negation"
      ]
    },
    {
      "id": "authored-016",
      "text": "That's not it.",
      "source": "authored",
      "source_id": null,
      "phoneme_tokens": 14,
      "stratum": "t1to20",
      "critical": [
        "negation"
      ]
    },
    {
      "id": "authored-017",
      "text": "Nobody answered.",
      "source": "authored",
      "source_id": null,
      "phoneme_tokens": 17,
      "stratum": "t1to20",
      "critical": [
        "negation"
      ]
    },
    {
      "id": "authored-018",
      "text": "Nothing yet.",
      "source": "authored",
      "source_id": null,
      "phoneme_tokens": 12,
      "stratum": "t1to20",
      "critical": [
        "negation"
      ]
    },
    {
      "id": "authored-020",
      "text": "Gate 12.",
      "source": "authored",
      "source_id": null,
      "phoneme_tokens": 12,
      "stratum": "t1to20",
      "critical": [
        "numeral"
      ]
    },
    {
      "id": "authored-021",
      "text": "It's 4:30.",
      "source": "authored",
      "source_id": null,
      "phoneme_tokens": 17,
      "stratum": "t1to20",
      "critical": [
        "numeral"
      ]
    },
    {
      "id": "authored-023",
      "text": "Pay $5.",
      "source": "authored",
      "source_id": null,
      "phoneme_tokens": 17,
      "stratum": "t1to20",
      "critical": [
        "numeral"
      ]
    },
    {
      "id": "authored-024",
      "text": "Page 7.",